{
  "opera": {
    "titolo": "Le città di pianura",
    "titolo_originale": "Le città di pianura",
    "autore": "Francesco Sossai",
    "altri_autori": [
      "Adriano Candiago (co-sceneggiatore)",
      "Massimiliano Kuveiller (direttore della fotografia)",
      "Krano (musiche originali)"
    ],
    "macrotipologia": "film",
    "genere": "road movie / dramma agrodolce con venature di commedia",
    "anno": 2025,
    "paese": "Italia, Germania (co-produzione)",
    "editore_produttore": "Vivo Film, Rai Cinema, Maze Pictures; distribuzione italiana: Lucky Red",
    "serie_o_ciclo": "Opera prima di Francesco Sossai (lungometraggio d'esordio).",
    "materiali_disponibili": [
      "Sinossi ufficiale del Festival di Cannes",
      "Schede critiche e recensioni in italiano (Mescalina, Close-up, MYmovies)",
      "Voci enciclopediche (Wikipedia italiano e inglese)",
      "Nessun accesso diretto al film da parte del compilatore"
    ],
    "fonti_utilizzate": [
      "it.wikipedia.org/wiki/Le_città_di_pianura",
      "en.wikipedia.org/wiki/The_Last_One_for_the_Road",
      "festival-cannes.com/en/f/le-citta-di-pianura/",
      "mymovies.it/film/2025/le-citta-di-pianura/",
      "close-up.info/le-citta-di-pianura-di-francesco-sossai/",
      "mescalina.it/cinema/recensioni/francesco-sossai/le-citt-di-pianura"
    ]
  },
  "sintesi_contenutistica": "Le città di pianura segue una notte e i giorni a essa contigui nella vita di tre uomini che si incrociano per caso nella pianura veneta. Carlobianchi e Doriano sono due cinquantenni squattrinati, fedeli all'imperativo di non saltare mai 'l'ultimo bicchiere'; Giulio è un giovane e timido studente di architettura, in apparente deriva esistenziale. L'incontro fortuito tra i due cinquantenni e il giovane si trasforma in un viaggio attraverso il Veneto — tra autogrill, bar di provincia, ville, periferie e infine Venezia — punteggiato da bevute, dialoghi vaganti, situazioni surreali e incontri secondari. Sullo sfondo del viaggio c'è l'attesa del ritorno dall'Argentina di un quarto amico, Genio, fuggito anni prima (in alcune fonti collocato attorno alla crisi del 2008) dopo un episodio di guadagno illecito legato alla vendita di scarti di una fabbrica di occhiali; ai due cinquantenni servirebbe ritrovare un denaro sepolto. Il percorso culminerebbe in una visita al Memoriale Brion di Carlo Scarpa ad Altivole, snodo simbolico per il giovane architetto in formazione. Alla fine, Giulio si separa dai due mentori improvvisati: il viaggio lo avrebbe trasformato, riorientando i suoi progetti di vita e d'amore. Le fonti descrivono l'esito come una iniziazione conclusa più per separazione che per integrazione: i due cinquantenni restano nel loro mondo, il giovane riparte.",
  "struttura_formale": {
    "descrizione": "Lungometraggio di circa 98–100 minuti (le fonti riportano valori leggermente diversi), strutturato come road movie a tre voci, con andamento episodico e progressione notte-giorno. La narrazione si dispiega per tappe geografiche e per incontri, più che per una trama a snodi forti: la coesione è data dalla coppia di mentori, dalla figura del giovane e dall'attesa del quarto amico assente. Girato in pellicola 16mm e 35mm.",
    "unita": [
      {
        "nome": "Apertura e incontro",
        "descrizione_sintetica": "Presentazione di Carlobianchi e Doriano, della loro routine notturna e dell'idea fissa de 'l'ultimo bicchiere'; incontro casuale con Giulio in un contesto di festeggiamenti universitari."
      },
      {
        "nome": "Avvio del viaggio",
        "descrizione_sintetica": "I tre intraprendono uno spostamento attraverso la pianura veneta, tra autogrill, bar e luoghi di provincia; emergono i tratti dei due cinquantenni e la loro estraneità ai codici contemporanei (mappe a mano contro GPS)."
      },
      {
        "nome": "Tappe nel Veneto e attesa di Genio",
        "descrizione_sintetica": "Una serie di soste e incontri secondari (tra cui il personaggio del Cavalier Fadìga) intreccia il viaggio con la storia pregressa dei due cinquantenni e con l'attesa del ritorno dall'Argentina di Genio."
      },
      {
        "nome": "Venezia e il Memoriale Brion",
        "descrizione_sintetica": "Spostamento verso Venezia e visita al Memoriale Brion di Carlo Scarpa ad Altivole: tappa segnalata dalle fonti come snodo simbolico per il giovane studente di architettura."
      },
      {
        "nome": "Separazione finale",
        "descrizione_sintetica": "Giulio si stacca dai due mentori improvvisati e riprende il proprio cammino; i due cinquantenni restano nel proprio mondo."
      }
    ],
    "scelte_formali_rilevanti": "Uso dichiarato di pellicola analogica (16 e 35mm), che le recensioni descrivono come scelta consapevolmente 'demodée'; uso del dialetto veneto nei dialoghi; ambientazioni reali identificate dalle fonti (Sedico, Feltre, Padova, Chioggia, Altivole — Memoriale Brion); colonna sonora originale di Krano; ricorrenza di motivi visivi della pianura, con contrasto tra cemento, periferie produttive e residui di paesaggio rurale e dolomitico."
  },
  "personaggi_figure_gruppi": [
    {
      "nome": "Giulio",
      "tipo": "personaggio",
      "ruolo": "Giovane studente di architettura, timido, che entra nel viaggio come elemento esterno e ne esce trasformato; svolge la funzione di figura iniziatica e di punto di vista mobile sul mondo dei due cinquantenni. Interpretato da Filippo Scotti.",
      "relazioni_principali": [
        "È introdotto al viaggio da Carlobianchi e Doriano",
        "Sviluppa un legame ambivalente con i due mentori",
        "Le fonti accennano a un sentimento non dichiarato verso un amico/coetaneo nel contesto della festa di laurea iniziale"
      ]
    },
    {
      "nome": "Carlobianchi",
      "tipo": "personaggio",
      "ruolo": "Cinquantenne squattrinato, parte della coppia di mentori improvvisati; rappresenta una figura di marginalità maschile veneta ostinatamente fedele a un proprio codice (bevuta, amicizia, rifiuto del decoro borghese). Interpretato da Sergio Romano.",
      "relazioni_principali": [
        "Coppia inseparabile con Doriano",
        "Mentore involontario di Giulio",
        "Legato per amicizia e storia pregressa a Genio"
      ]
    },
    {
      "nome": "Doriano",
      "tipo": "personaggio",
      "ruolo": "Cinquantenne squattrinato, controparte e specchio di Carlobianchi; condivide con lui codice di vita, mancanza di prospettive e fedeltà al rituale dell'ultimo bicchiere. Interpretato da Pierpaolo Capovilla.",
      "relazioni_principali": [
        "Coppia inseparabile con Carlobianchi",
        "Mentore involontario di Giulio",
        "Legato per amicizia e storia pregressa a Genio"
      ]
    },
    {
      "nome": "Genio",
      "tipo": "personaggio",
      "ruolo": "Quarto amico, assente per gran parte del film: emigrato in Argentina dopo un episodio illecito (vendita di scarti di una fabbrica di occhiali, collocato in alcune fonti attorno alla crisi del 2008), il suo ritorno è atteso come orizzonte del viaggio. Interpretato da Andrea Pennacchi.",
      "relazioni_principali": [
        "Vecchio amico e complice di Carlobianchi e Doriano",
        "Figura attesa, motore narrativo dell'attesa"
      ]
    },
    {
      "nome": "Cavalier Fadìga",
      "tipo": "personaggio",
      "ruolo": "Figura secondaria incontrata lungo il viaggio, riconducibile a una tipologia umana riconoscibile del Veneto produttivo. Interpretato da Roberto Citran.",
      "relazioni_principali": [
        "Si interseca con il percorso dei tre protagonisti in una delle tappe del viaggio"
      ]
    },
    {
      "nome": "La pianura veneta",
      "tipo": "figura_simbolica",
      "ruolo": "Le fonti descrivono il paesaggio del Veneto — capannoni, ville, autogrill, periferie urbanizzate, contrasto fra cemento e dolomite — come una presenza tematica e visiva costante, al limite di una figura collettiva: territorio degli incontri e oggetto del lutto implicito dei protagonisti.",
      "relazioni_principali": [
        "Sfondo e co-protagonista del viaggio dei tre personaggi"
      ]
    }
  ],
  "scene_momenti_chiave": [
    {
      "titolo_sintetico": "L'incontro iniziale",
      "posizione_nell_opera": "Parte iniziale",
      "descrizione": "Carlobianchi e Doriano incrociano per caso Giulio in occasione di una festa di laurea: l'incontro innesca l'aggregazione del giovane al viaggio dei due cinquantenni."
    },
    {
      "titolo_sintetico": "Mappe a mano contro GPS",
      "posizione_nell_opera": "Lungo il viaggio",
      "descrizione": "Le recensioni segnalano momenti in cui i due cinquantenni rifiutano gli strumenti di navigazione digitali e si orientano con mappe disegnate o ricordi, esibendo un rapporto anacronistico con la geografia del Veneto."
    },
    {
      "titolo_sintetico": "Sequenza delle case 'Vendesi'",
      "posizione_nell_opera": "Sezione centrale",
      "descrizione": "Le recensioni indicano una sequenza descrittiva di abitazioni in vendita e architetture residenziali abbandonate o invendute, come passaggio formale rilevante che fotografa lo stato del territorio."
    },
    {
      "titolo_sintetico": "Venezia dalla pianura",
      "posizione_nell_opera": "Sezione avanzata del film",
      "descrizione": "Lo spostamento verso Venezia, raggiunta dalla pianura, è descritto dalle fonti come un emergere simbolico della città dal paesaggio agricolo-industriale circostante."
    },
    {
      "titolo_sintetico": "Il Memoriale Brion di Carlo Scarpa",
      "posizione_nell_opera": "Vicino al climax",
      "descrizione": "La visita al Memoriale Brion ad Altivole è descritta dalle recensioni come tappa chiave del film e snodo significativo per Giulio, studente di architettura."
    },
    {
      "titolo_sintetico": "La separazione finale",
      "posizione_nell_opera": "Finale",